{
  "schema_version": 1,
  "id": "19.4",
  "task": "19.4",
  "roles": [
    "control"
  ],
  "module": "integration/release_barrier.js",
  "entry": "createComponent",
  "api_version": 1,
  "actions": [
    "integration.release.create",
    "integration.release.inspect",
    "integration.release.evaluate"
  ],
  "requires": [
    "19.3"
  ]
}
