{
  "schema_version": 1,
  "id": "19.2",
  "task": "19.2",
  "roles": [
    "control"
  ],
  "module": "integration/publication.js",
  "entry": "createComponent",
  "api_version": 1,
  "actions": [
    "integration.publication.capabilities",
    "integration.publication.authorize",
    "integration.publication.execute",
    "integration.publication.reconcile",
    "integration.publication.inspect",
    "integration.publication.protection"
  ],
  "requires": [
    "19.1"
  ]
}
