{
  "schema_version": 1,
  "id": "16.4",
  "task": "16.4",
  "roles": [
    "control"
  ],
  "module": "assurance/validity.js",
  "entry": "createComponent",
  "api_version": 1,
  "actions": [
    "assurance.validity.inspect",
    "assurance.invalidate",
    "assurance.requalification.accept"
  ],
  "requires": [
    "16.3"
  ]
}
