{
  "schema_version": 1,
  "id": "5.3",
  "task": "5.3",
  "roles": [
    "control"
  ],
  "module": "scheduler/dispatch.js",
  "entry": "createComponent",
  "api_version": 1,
  "actions": [
    "scheduler.dispatch.ensure",
    "scheduler.dispatch.reconcile",
    "scheduler.dispatch.consume"
  ],
  "requires": [
    "5.2",
    "5.4",
    "4.2",
    "3.1",
    "6.1",
    "14.1",
    "6.2"
  ]
}
