{
  "schema_version": 1,
  "id": "12.1",
  "task": "12.1",
  "roles": [
    "control"
  ],
  "module": "runner/bridge.js",
  "entry": "createComponent",
  "api_version": 1,
  "actions": [
    "runner.registry.observe",
    "runner.registry.describe"
  ],
  "requires": [
    "4.2",
    "14.1",
    "8.2"
  ]
}
